objectid,filename,title,date,location,description,timestamp,subject,relation,rights,duration,camera_angle,contributor,frame_width,frame_height,frame_rate,display_template,object_location,youtubeid,format
054,,Ballerina,2017-05-05,"Grinnell, Iowa",Inspired by a delicate ballerina. A graceful lullaby waltz.,00:00:01 opening; 00:00:12 melody; 00:00:34 variation; 00:00:48 repeat,dance; graceful; delicate; lullaby; waltz,,"This content belongs to Maria Shriver. For permission to use this content, please contact the creator.",00:01:26,face-down,,720,1280,15.00 fps,video,https://youtube.com/shorts/O4IXv1URxXw?feature=share,O4IXv1URxXw,record
055,,Rainy Day,2017-04-20,"Grinnell, Iowa","Inspired by a thunderstorm. An ominous, restless melody that builds tension like a brewing storm.",00:00:01 melody; 00:00:52 building tension; 00:01:44 melody,ominous; restless; building tension; thunderstorm; rain,,"This content belongs to Maria Shriver. For permission to use this content, please contact the creator.",00:02:12,face-down,,360,640,15.00 fps,video,https://youtube.com/shorts/fn3iy8DNPzY?feature=share,fn3iy8DNPzY,record
056,,Train Ride,2017-04-17,"Grinnell, Iowa",Inspired by a steam engine. An upbeat melody with a chugging pulse.,00:00:01 melody; 00:00:34 chugging begins,upbeat; train,,"This content belongs to Maria Shriver. For permission to use this content, please contact the creator.",00:01:56,face-down,,360,640,15.00 fps,video,https://youtube.com/shorts/3z3KPR842CM?feature=share,3z3KPR842CM,record
057,,Misty Mountains,2017-04-17,"Grinnell, Iowa","Inspired by an empty, echoing landscape. A wistful, forlorn melody.",00:00:01 opening; 00:00:24 melody; 00:00:50 variation; 00:01:15 melody; 00:01:36 ending,wistful; forlorn; echoes,,"This content belongs to Maria Shriver. For permission to use this content, please contact the creator.",00:01:56,face-down,,720,1280,15.00 fps,video,https://youtube.com/shorts/yLC5P6g1S4k?feature=share,yLC5P6g1S4k,record
058,,Galloping,2017-04-17,"Grinnell, Iowa","Inspired by a galloping horse. A determined, upbeat melody with a steady pulse.",00:00:01 melody; 00:00:29 bridge; 00:00:57 melody; 00:01:20 variation; 00:01:35 melody,determined; upbeat; steady; galloping,,"This content belongs to Maria Shriver. For permission to use this content, please contact the creator.",00:02:04,face-down,,720,1280,15.00 fps,video,https://youtube.com/shorts/a1ZVpBBPoBM?feature=share,a1ZVpBBPoBM,record
059,,Lullaby,2017-04-17,"Grinnell, Iowa","A tender, delicate lullaby.",00:00:01 opening; 00:00:16 melody; 00:00:42 repeat,tender; delicate; lullaby,,"This content belongs to Maria Shriver. For permission to use this content, please contact the creator.",00:01:27,face-down,,720,1280,15.00 fps,video,https://youtube.com/shorts/oSdAzbAnnlA?feature=share,oSdAzbAnnlA,record
060,,Japanese Breeze,2017-04-17,"Grinnell, Iowa","A refreshing, spirited melody.",00:00:01 melody; 00:00:30 repeat,refreshing; spirited,,"This content belongs to Maria Shriver. For permission to use this content, please contact the creator.",00:01:00,face-down,,640,360,15.00 fps,video,https://youtu.be/N0mCClqzyC0,N0mCClqzyC0,record
061,,Grandma's House,2017-04-17,"Grinnell, Iowa","Inspired by tender nostalgia for a loved one's home. A bittersweet, wistful melody.",00:00:01 melody; 00:00:30 variation; 00:00:48 melody,tender; bittersweet; wistful,,"This content belongs to Maria Shriver. For permission to use this content, please contact the creator.",00:01:19,face-down,,640,360,15.00 fps,video,https://youtu.be/hxcgTz1Ym-A,hxcgTz1Ym-A,record
062,,Fairytale,2017-04-13,"Grinnell, Iowa","Inspired by a mysterious fairytale. A wistful, fluttering melody.",00:00:01 melody; 00:01:14 repeat; 00:02:26 repeat,mysterious; wistful; fluttering; fantasy,,"This content belongs to Maria Shriver. For permission to use this content, please contact the creator.",00:03:10,face-down,,360,640,15.00 fps,video,https://youtu.be/LrPbUWDWSh0,LrPbUWDWSh0,record
063,,March of the Ents,2017-04-12,"Grinnell, Iowa","Inspired by an ancient forest coming to life in book two of Tolkien's Lord of the Rings trilogy. A fluttering opening conveys a peaceful stillness, followed by a mysterious, wandering waltz as the forest stirs. At times, the waltz changes mood to reflect the forest's sorrow, joy, and wrath, until an eventual return to stillness.",00:00:00 stillness; 00:00:41 stirring; 00:01:19 sorrow; 00:02:14 wrath; 00:02:30 joy; 00:03:00 stillness,fluttering; mysterious; wandering; waltz; moody; fantasy,"Tolkien, J. R. R. (John Ronald Reuel), 1892-1973. | Two towers","This content belongs to Maria Shriver. For permission to use this content, please contact the creator.",00:03:42,face-down,,360,640,15.00 fps,video,https://youtu.be/xbsmPOrl8PE,xbsmPOrl8PE,record
064,,Reflections,2017-04-12,"Grinnell, Iowa","Inspired by reflections of light and sound. A pensive opening with two voices leads into a bouncing, upbeat melody.",00:00:01 opening; 00:00:36 melody; 00:01:13 bridge; 00:01:28 repeat,pensive; two voices; bouncing; upbeat; echoes,,"This content belongs to Maria Shriver. For permission to use this content, please contact the creator.",00:02:47,face-down,,720,1280,15.00 fps,video,https://youtube.com/shorts/vKY8U8CFbPk?feature=share,vKY8U8CFbPk,record
065,,Sunrise,2017-04-12,"Grinnell, Iowa","Inspired by dawn.  A cheerful piece with sweeping chords and a fluttering, bouncing melody conveying feelings of hope and bliss.",00:00:01 opening; 00:00:39 melody; 00:01:39 variation; 00:01:56 melody,cheerful; fluttering; bouncing; hopeful; blissful; upbeat,,"This content belongs to Maria Shriver. For permission to use this content, please contact the creator.",00:02:23,face-down,,360,640,15.00 fps,video,https://youtube.com/shorts/LBFCto6uOuk?feature=share,LBFCto6uOuk,record
066,,Thunderstorm,2017-04-12,"Grinnell, Iowa","Inspired by a brewing storm. A spooky melody with drumming low notes and striking high notes mimicking the sounds of rain, thunder, and lightning.",00:00:001 melody 1; 00:00:37 melody 2; 00:00:56 building momentum; 00:01:20 variation; 00:02:08 melody 1,spooky; drumming; striking; rain; thunderstorm,,"This content belongs to Maria Shriver. For permission to use this content, please contact the creator.",00:02:28,face-down,,360,640,15.00 fps,video,https://youtube.com/shorts/0clgPZgCDKY,0clgPZgCDKY,record
067,,Droplets,2017-04-12,"Grinnell, Iowa","Inspired by droplets of water. A spirited, bouncing melody with syncopated rhythms.",00:00:00 melody 1; 00:00:51 bridge; 00:01:10 melody 2; 00:01:45 variation,spirited; bouncing; syncopated; water,,"This content belongs to Maria Shriver. For permission to use this content, please contact the creator.",00:02:32,face-down,,360,640,15.00 fps,video,https://youtube.com/shorts/E7MdqvdwNi4?feature=share,E7MdqvdwNi4,record
068,,Don't Go,2025-05-26,"Coralville, Iowa","Inspired by a desire to hold onto something special that will soon be lost. A pleading, passionate, and bittersweet melody.",00:00:04 opening; 00:00:30 melody; 00:01:50 variation,pleading; passionate; bittersweet,,"This content belongs to Maria Shriver. For permission to use this content, please contact the creator.",00:03:17,right-facing,,1270,720,29.97 fps,video,https://youtu.be/Ljrx6eG0-zc,Ljrx6eG0-zc,record
069,,Poor Little Nobody,2025-06-22,"Coralville, Iowa","Inspired by a piteous hymn that my grandmother used to sing to my mother. A slow and sorrowful melody accelerates into a playful dance.",00:00:03 hymn; 00:00:32 Rocky meows; 00:00:42 dance,forlorn; bouncing; playful; dance,,"This content belongs to Maria Shriver. For permission to use this content, please contact the creator.",00:02:02,right-facing,"Rocky, 2023-",1270,720,30.00 fps,video,https://www.youtube.com/watch?v=7FxN9j8eFok,7FxN9j8eFok,record
